Microsoft Windows [Version 6.1.7600]
Copyright (c) 2009 Microsoft Corporation.  All rights reserved.

C:\Users\HARIYANTO>cd\

C:\>cd xampp/mysql/bin

C:\xampp\mysql\bin>mysql -u root -p
Enter password:
Welcome to the MySQL monitor.  Commands end with ; or \g.
Your MySQL connection id is 7
Server version: 5.6.21 MySQL Community Server (GPL)

Copyright (c) 2000, 2014, Oracle and/or its affiliates. All rights reserved.

Oracle is a registered trademark of Oracle Corporation and/or its
affiliates. Other names may be trademarks of their respective
owners.

Type 'help;' or '\h' for help. Type '\c' to clear the current input statement.

mysql> show databases;
+--------------------+
| Database           |
+--------------------+
| information_schema |
| cdcol              |
| client_test_db     |
| erp_semen          |
| erp_semen1         |
| latihan            |
| latihan1           |
| mysql              |
| performance_schema |
| phpmyadmin         |
| sekolah            |
| semen_timbangan    |
| test               |
| webauth            |
+--------------------+
14 rows in set (0.00 sec)

mysql> use latihan;
Database changed
mysql> show tables;
+-------------------+
| Tables_in_latihan |
+-------------------+
| mahasiswa         |
| mhs               |
| pegawai           |
| pet               |
| siswa             |
+-------------------+
5 rows in set (0.00 sec)

mysql> use latihan;
Database changed
mysql> create table mahasiswa
    -> (nim varchar(10) primary key,
    -> nama varchar(30) not null,
    -> alamat_jalan varchar(100) not null,
    -> kota varchar(20) not null,
    -> kodepos varchar(5) not null,
    -> no_hp varchar(12) not null,
    -> jenis_kelamin varchar(15) not null,
    -> tanggal_lahir date not null,
    -> kode_dosen varchar(10) not null);
Query OK, 0 rows affected (0.46 sec)

mysql> desc mahasiswa;
+---------------+--------------+------+-----+---------+-------+
| Field         | Type         | Null | Key | Default | Extra |
+---------------+--------------+------+-----+---------+-------+
| nim           | varchar(10)  | NO   | PRI | NULL    |       |
| nama          | varchar(30)  | NO   |     | NULL    |       |
| alamat_jalan  | varchar(100) | NO   |     | NULL    |       |
| kota          | varchar(20)  | NO   |     | NULL    |       |
| kodepos       | varchar(5)   | NO   |     | NULL    |       |
| no_hp         | varchar(12)  | NO   |     | NULL    |       |
| jenis_kelamin | varchar(15)  | NO   |     | NULL    |       |
| tanggal_lahir | date         | NO   |     | NULL    |       |
| kode_dosen    | varchar(10)  | NO   |     | NULL    |       |
+---------------+--------------+------+-----+---------+-------+
9 rows in set (0.01 sec)

mysql> insert into mahasiswa
    -> (nim, nama, alamat_jalan, kota, kodepos, no_hp, jenis_kelamin, tanggal_lahir, kode_dosen)
    -> values
    -> ("11223344", "Ari Santoso", "Jl.Kayu Ringin No.12", "Bekasi", "17145", "081326444555", "Laki-laki", "1998-10-12", "PBD10"),
    -> ("11223345", "Ario Talib", "Jl.Cikarang Baru Raya No.99", "Cikarang", "17530", "08771818777888", "Laki-laki", "1999-11-16", "PBD15"),
    -> ("11223346", "Dina Marlina", "Jl.Proklamasi No.17", "Karawang", "41312", "0857831919777", "Perempuan", "1997-12-01", "PBD12"),
    -> ("11223347", "Lisa Ayu", "Jl.Jend. Ahmad Yani No.112", "Bekasi", "17146", "081912123435", "Perempuan", "1996-01-02", "PBD19"),
    -> ("11223348", "Tiara Wahidah", "Jl.Cut Mutia No.88", "Bekasi", "17147", "081288889999", "Perempuan", "1980-02-05", "PBD17"),
    -> ("11223349", "Anton Sinaga", "Jl.Pangeran Diponegoro No.77", "Cikarang", "17531", "087760303310", "Laki-laki", "1988-03-10", "PBD25");
Query OK, 6 rows affected, 2 warnings (0.06 sec)
Records: 6  Duplicates: 0  Warnings: 2

mysql> select * from mahasiswa;
+----------+---------------+------------------------------+----------+---------+--------------+---------------+---------------+------------+
| nim      | nama          | alamat_jalan                 | kota     | kodepos | no_hp        | jenis_kelamin | tanggal_lahir | kode_dosen |
+----------+---------------+------------------------------+----------+---------+--------------+---------------+---------------+------------+
| 11223344 | Ari Santoso   | Jl.Kayu Ringin No.12         | Bekasi   | 17145   | 081326444555 | Laki-laki     | 1998-10-12    | PBD10      |
| 11223345 | Ario Talib    | Jl.Cikarang Baru Raya No.99  | Cikarang | 17530   | 087718187778 | Laki-laki     | 1999-11-16    | PBD15      |
| 11223346 | Dina Marlina  | Jl.Proklamasi No.17          | Karawang | 41312   | 085783191977 | Perempuan     | 1997-12-01    | PBD12      |
| 11223347 | Lisa Ayu      | Jl.Jend. Ahmad Yani No.112   | Bekasi   | 17146   | 081912123435 | Perempuan     | 1996-01-02    | PBD19      |
| 11223348 | Tiara Wahidah | Jl.Cut Mutia No.88           | Bekasi   | 17147   | 081288889999 | Perempuan     | 1980-02-05    | PBD17      |
| 11223349 | Anton Sinaga  | Jl.Pangeran Diponegoro No.77 | Cikarang | 17531   | 087760303310 | Laki-laki     | 1988-03-10    | PBD25      |
+----------+---------------+------------------------------+----------+---------+--------------+---------------+---------------+------------+
6 rows in set (0.00 sec)

mysql> update mahasiswa set tanggal_lahir="1979-08-31" where nama="Ari Santoso";
Query OK, 1 row affected (0.03 sec)
Rows matched: 1  Changed: 1  Warnings: 0

mysql> select * from mahasiswa where nama="Ari Santoso";
+----------+-------------+----------------------+--------+---------+--------------+---------------+---------------+------------+
| nim      | nama        | alamat_jalan         | kota   | kodepos | no_hp        | jenis_kelamin | tanggal_lahir | kode_dosen |
+----------+-------------+----------------------+--------+---------+--------------+---------------+---------------+------------+
| 11223344 | Ari Santoso | Jl.Kayu Ringin No.12 | Bekasi | 17145   | 081326444555 | Laki-laki     | 1979-08-31    | PBD10      |
+----------+-------------+----------------------+--------+---------+--------------+---------------+---------------+------------+
1 row in set (0.00 sec)

mysql> delete from mahasiswa where nama="Dina Marlina";
Query OK, 1 row affected (0.06 sec)

mysql> select * from mahasiswa;
+----------+---------------+------------------------------+----------+---------+--------------+---------------+---------------+------------+
| nim      | nama          | alamat_jalan                 | kota     | kodepos | no_hp        | jenis_kelamin | tanggal_lahir | kode_dosen |
+----------+---------------+------------------------------+----------+---------+--------------+---------------+---------------+------------+
| 11223344 | Ari Santoso   | Jl.Kayu Ringin No.12         | Bekasi   | 17145   | 081326444555 | Laki-laki     | 1979-08-31    | PBD10      |
| 11223345 | Ario Talib    | Jl.Cikarang Baru Raya No.99  | Cikarang | 17530   | 087718187778 | Laki-laki     | 1999-11-16    | PBD15      |
| 11223347 | Lisa Ayu      | Jl.Jend. Ahmad Yani No.112   | Bekasi   | 17146   | 081912123435 | Perempuan     | 1996-01-02    | PBD19      |
| 11223348 | Tiara Wahidah | Jl.Cut Mutia No.88           | Bekasi   | 17147   | 081288889999 | Perempuan     | 1980-02-05    | PBD17      |
| 11223349 | Anton Sinaga  | Jl.Pangeran Diponegoro No.77 | Cikarang | 17531   | 087760303310 | Laki-laki     | 1988-03-10    | PBD25      |
+----------+---------------+------------------------------+----------+---------+--------------+---------------+---------------+------------+
5 rows in set (0.00 sec)

mysql> select nama, tanggal_lahir from mahasiswa where tanggal_lahir >="1996-01-02" order by nama;
+------------+---------------+
| nama       | tanggal_lahir |
+------------+---------------+
| Ario Talib | 1999-11-16    |
| Lisa Ayu   | 1996-01-02    |
+------------+---------------+
2 rows in set (0.00 sec)

mysql> select nama, jenis_kelamin, kota from mahasiswa where kota="Bekasi" and jenis_kelamin="Perempuan";
+---------------+---------------+--------+
| nama          | jenis_kelamin | kota   |
+---------------+---------------+--------+
| Lisa Ayu      | Perempuan     | Bekasi |
| Tiara Wahidah | Perempuan     | Bekasi |
+---------------+---------------+--------+
2 rows in set (0.00 sec)

mysql> select * from mahasiswa where jenis_kelamin="Laki-laki" and kota="Bekasi" or tanggal_lahir <="1997" and jenis_kelamin="Perempuan";
+----------+---------------+----------------------------+--------+---------+--------------+---------------+---------------+------------+
| nim      | nama          | alamat_jalan               | kota   | kodepos | no_hp        | jenis_kelamin | tanggal_lahir | kode_dosen |
+----------+---------------+----------------------------+--------+---------+--------------+---------------+---------------+------------+
| 11223344 | Ari Santoso   | Jl.Kayu Ringin No.12       | Bekasi | 17145   | 081326444555 | Laki-laki     | 1979-08-31    | PBD10      |
| 11223347 | Lisa Ayu      | Jl.Jend. Ahmad Yani No.112 | Bekasi | 17146   | 081912123435 | Perempuan     | 1996-01-02    | PBD19      |
| 11223348 | Tiara Wahidah | Jl.Cut Mutia No.88         | Bekasi | 17147   | 081288889999 | Perempuan     | 1980-02-05    | PBD17      |
+----------+---------------+----------------------------+--------+---------+--------------+---------------+---------------+------------+
3 rows in set, 1 warning (0.00 sec)

mysql> select nama, alamat_jalan from mahasiswa;
+---------------+------------------------------+
| nama          | alamat_jalan                 |
+---------------+------------------------------+
| Ari Santoso   | Jl.Kayu Ringin No.12         |
| Ario Talib    | Jl.Cikarang Baru Raya No.99  |
| Lisa Ayu      | Jl.Jend. Ahmad Yani No.112   |
| Tiara Wahidah | Jl.Cut Mutia No.88           |
| Anton Sinaga  | Jl.Pangeran Diponegoro No.77 |
+---------------+------------------------------+
5 rows in set (0.00 sec)

mysql> select * from mahasiswa order by nama asc;
+----------+---------------+------------------------------+----------+---------+--------------+---------------+---------------+------------+
| nim      | nama          | alamat_jalan                 | kota     | kodepos | no_hp        | jenis_kelamin | tanggal_lahir | kode_dosen |
+----------+---------------+------------------------------+----------+---------+--------------+---------------+---------------+------------+
| 11223349 | Anton Sinaga  | Jl.Pangeran Diponegoro No.77 | Cikarang | 17531   | 087760303310 | Laki-laki     | 1988-03-10    | PBD25      |
| 11223344 | Ari Santoso   | Jl.Kayu Ringin No.12         | Bekasi   | 17145   | 081326444555 | Laki-laki     | 1979-08-31    | PBD10      |
| 11223345 | Ario Talib    | Jl.Cikarang Baru Raya No.99  | Cikarang | 17530   | 087718187778 | Laki-laki     | 1999-11-16    | PBD15      |
| 11223347 | Lisa Ayu      | Jl.Jend. Ahmad Yani No.112   | Bekasi   | 17146   | 081912123435 | Perempuan     | 1996-01-02    | PBD19      |
| 11223348 | Tiara Wahidah | Jl.Cut Mutia No.88           | Bekasi   | 17147   | 081288889999 | Perempuan     | 1980-02-05    | PBD17      |
+----------+---------------+------------------------------+----------+---------+--------------+---------------+---------------+------------+
5 rows in set (0.00 sec)

mysql>